{"schemaVersion":"1.0.0","catalogVersion":7,"measuredAtEpochSeconds":1999000,"models":[{"modelId":"model-alpha","revision":2,"providerFamily":"provider-a","providerModelKey":"alpha-v2","locality":"public_remote","contextWindowTokens":128000,"maximumOutputTokens":16000,"inputCostMicrosPerMillion":600,"outputCostMicrosPerMillion":1200,"medianLatencyMs":900,"supportsStructuredOutput":true,"supportsToolCalling":true,"supportsVision":false,"supportsReasoning":true,"safetyTier":5,"benchmarkEvidence":[{"dimension":"long_form_coherence","scoreBasisPoints":9200,"sampleCount":100,"confidenceBasisPoints":9000,"measuredAtEpochSeconds":1999000,"sourceId":"fixture-evidence","sourceDigestSha256":"bbbbbbbbbbbbbbbbbbbbbbbbbbbbbbbbbbbbbbbbbbbbbbbbbbbbbbbbbbbbbbbb"},{"dimension":"instruction_following","scoreBasisPoints":9200,"sampleCount":100,"confidenceBasisPoints":9000,"measuredAtEpochSeconds":1999000,"sourceId":"fixture-evidence","sourceDigestSha256":"bbbbbbbbbbbbbbbbbbbbbbbbbbbbbbbbbbbbbbbbbbbbbbbbbbbbbbbbbbbbbbbb"}]},{"modelId":"model-beta","revision":1,"providerFamily":"provider-b","providerModelKey":"beta-v1","locality":"private_remote","contextWindowTokens":96000,"maximumOutputTokens":12000,"inputCostMicrosPerMillion":400,"outputCostMicrosPerMillion":800,"medianLatencyMs":700,"supportsStructuredOutput":true,"supportsToolCalling":true,"supportsVision":false,"supportsReasoning":true,"safetyTier":5,"benchmarkEvidence":[{"dimension":"long_form_coherence","scoreBasisPoints":8600,"sampleCount":100,"confidenceBasisPoints":9000,"measuredAtEpochSeconds":1999000,"sourceId":"fixture-evidence","sourceDigestSha256":"bbbbbbbbbbbbbbbbbbbbbbbbbbbbbbbbbbbbbbbbbbbbbbbbbbbbbbbbbbbbbbbb"},{"dimension":"instruction_following","scoreBasisPoints":8600,"sampleCount":100,"confidenceBasisPoints":9000,"measuredAtEpochSeconds":1999000,"sourceId":"fixture-evidence","sourceDigestSha256":"bbbbbbbbbbbbbbbbbbbbbbbbbbbbbbbbbbbbbbbbbbbbbbbbbbbbbbbbbbbbbbbb"}]},{"modelId":"model-gamma","revision":1,"providerFamily":"provider-c","providerModelKey":"gamma-v1","locality":"public_remote","contextWindowTokens":64000,"maximumOutputTokens":8000,"inputCostMicrosPerMillion":250,"outputCostMicrosPerMillion":500,"medianLatencyMs":500,"supportsStructuredOutput":true,"supportsToolCalling":true,"supportsVision":false,"supportsReasoning":true,"safetyTier":4,"benchmarkEvidence":[{"dimension":"long_form_coherence","scoreBasisPoints":8000,"sampleCount":100,"confidenceBasisPoints":9000,"measuredAtEpochSeconds":1999000,"sourceId":"fixture-evidence","sourceDigestSha256":"bbbbbbbbbbbbbbbbbbbbbbbbbbbbbbbbbbbbbbbbbbbbbbbbbbbbbbbbbbbbbbbb"},{"dimension":"instruction_following","scoreBasisPoints":8000,"sampleCount":100,"confidenceBasisPoints":9000,"measuredAtEpochSeconds":1999000,"sourceId":"fixture-evidence","sourceDigestSha256":"bbbbbbbbbbbbbbbbbbbbbbbbbbbbbbbbbbbbbbbbbbbbbbbbbbbbbbbbbbbbbbbb"}]},{"modelId":"model-local","revision":3,"providerFamily":"local-runtime","providerModelKey":"local-v3","locality":"local","contextWindowTokens":64000,"maximumOutputTokens":8000,"inputCostMicrosPerMillion":0,"outputCostMicrosPerMillion":0,"medianLatencyMs":1100,"supportsStructuredOutput":true,"supportsToolCalling":true,"supportsVision":false,"supportsReasoning":true,"safetyTier":4,"benchmarkEvidence":[{"dimension":"long_form_coherence","scoreBasisPoints":7700,"sampleCount":100,"confidenceBasisPoints":9000,"measuredAtEpochSeconds":1999000,"sourceId":"fixture-evidence","sourceDigestSha256":"bbbbbbbbbbbbbbbbbbbbbbbbbbbbbbbbbbbbbbbbbbbbbbbbbbbbbbbbbbbbbbbb"},{"dimension":"instruction_following","scoreBasisPoints":7700,"sampleCount":100,"confidenceBasisPoints":9000,"measuredAtEpochSeconds":1999000,"sourceId":"fixture-evidence","sourceDigestSha256":"bbbbbbbbbbbbbbbbbbbbbbbbbbbbbbbbbbbbbbbbbbbbbbbbbbbbbbbbbbbbbbbb"}]},{"modelId":"model-fallback","revision":1,"providerFamily":"provider-d","providerModelKey":"fallback-v1","locality":"private_remote","contextWindowTokens":64000,"maximumOutputTokens":8000,"inputCostMicrosPerMillion":100,"outputCostMicrosPerMillion":200,"medianLatencyMs":800,"supportsStructuredOutput":true,"supportsToolCalling":true,"supportsVision":false,"supportsReasoning":true,"safetyTier":4,"benchmarkEvidence":[{"dimension":"long_form_coherence","scoreBasisPoints":7500,"sampleCount":100,"confidenceBasisPoints":9000,"measuredAtEpochSeconds":1999000,"sourceId":"fixture-evidence","sourceDigestSha256":"bbbbbbbbbbbbbbbbbbbbbbbbbbbbbbbbbbbbbbbbbbbbbbbbbbbbbbbbbbbbbbbb"},{"dimension":"instruction_following","scoreBasisPoints":7500,"sampleCount":100,"confidenceBasisPoints":9000,"measuredAtEpochSeconds":1999000,"sourceId":"fixture-evidence","sourceDigestSha256":"bbbbbbbbbbbbbbbbbbbbbbbbbbbbbbbbbbbbbbbbbbbbbbbbbbbbbbbbbbbbbbbb"}]}],"rolePolicies":[{"roleId":"long-form-author","version":1,"primaryModelIds":["model-alpha","model-beta"],"fallbackModelIds":["model-local"],"requiredDimensions":["long_form_coherence","instruction_following"],"maximumEvidenceAgeSeconds":10000,"minimumConfidenceBasisPoints":8000,"minimumContextWindowTokens":32000,"minimumOutputTokens":4000,"maximumInputCostMicrosPerMillion":10000,"maximumOutputCostMicrosPerMillion":20000,"maximumMedianLatencyMs":5000,"minimumSafetyTier":3,"allowedLocalities":["local","private_remote","public_remote"],"requiresStructuredOutput":true,"requiresToolCalling":true,"requiresVision":false,"requiresReasoning":true,"weightsBasisPoints":{"long_form_coherence":6000,"instruction_following":4000}},{"roleId":"structural-editor","version":1,"primaryModelIds":["model-beta","model-gamma"],"fallbackModelIds":["model-alpha"],"requiredDimensions":["long_form_coherence","instruction_following"],"maximumEvidenceAgeSeconds":10000,"minimumConfidenceBasisPoints":8000,"minimumContextWindowTokens":32000,"minimumOutputTokens":4000,"maximumInputCostMicrosPerMillion":10000,"maximumOutputCostMicrosPerMillion":20000,"maximumMedianLatencyMs":5000,"minimumSafetyTier":3,"allowedLocalities":["local","private_remote","public_remote"],"requiresStructuredOutput":true,"requiresToolCalling":true,"requiresVision":false,"requiresReasoning":true,"weightsBasisPoints":{"long_form_coherence":6000,"instruction_following":4000}},{"roleId":"quality-auditor","version":1,"primaryModelIds":["model-alpha","model-gamma"],"fallbackModelIds":["model-beta"],"requiredDimensions":["long_form_coherence","instruction_following"],"maximumEvidenceAgeSeconds":10000,"minimumConfidenceBasisPoints":8000,"minimumContextWindowTokens":32000,"minimumOutputTokens":4000,"maximumInputCostMicrosPerMillion":10000,"maximumOutputCostMicrosPerMillion":20000,"maximumMedianLatencyMs":5000,"minimumSafetyTier":3,"allowedLocalities":["local","private_remote","public_remote"],"requiresStructuredOutput":true,"requiresToolCalling":true,"requiresVision":false,"requiresReasoning":true,"weightsBasisPoints":{"long_form_coherence":6000,"instruction_following":4000}},{"roleId":"release-preparer","version":1,"primaryModelIds":["model-beta"],"fallbackModelIds":["model-alpha"],"requiredDimensions":["long_form_coherence","instruction_following"],"maximumEvidenceAgeSeconds":10000,"minimumConfidenceBasisPoints":8000,"minimumContextWindowTokens":32000,"minimumOutputTokens":4000,"maximumInputCostMicrosPerMillion":10000,"maximumOutputCostMicrosPerMillion":20000,"maximumMedianLatencyMs":5000,"minimumSafetyTier":3,"allowedLocalities":["local","private_remote","public_remote"],"requiresStructuredOutput":true,"requiresToolCalling":true,"requiresVision":false,"requiresReasoning":true,"weightsBasisPoints":{"long_form_coherence":6000,"instruction_following":4000}},{"roleId":"local-only-author","version":1,"primaryModelIds":["model-local"],"fallbackModelIds":[],"requiredDimensions":["long_form_coherence","instruction_following"],"maximumEvidenceAgeSeconds":10000,"minimumConfidenceBasisPoints":8000,"minimumContextWindowTokens":32000,"minimumOutputTokens":4000,"maximumInputCostMicrosPerMillion":10000,"maximumOutputCostMicrosPerMillion":20000,"maximumMedianLatencyMs":5000,"minimumSafetyTier":3,"allowedLocalities":["local"],"requiresStructuredOutput":true,"requiresToolCalling":true,"requiresVision":false,"requiresReasoning":true,"weightsBasisPoints":{"long_form_coherence":6000,"instruction_following":4000}}]}